{
    "$schema": "../../schemas/talent.schema.json",
    "slug": "litmus",
    "nickname": "Litmus",
    "nationalities": ["gb"],
    "links": [
        { "name": "Steam", "url": "https://steamcommunity.com/id/Litmusq" },
        { "name": "Twitch", "url": "https://x.com/Litmusq" },
        { "name": "Twitter", "url": "https://x.com/Litmusq" },
        { "name": "YouTube", "url": "https://www.youtube.com/@Litmusq" }
    ]
}
